{
  "$schema": "http://json-schema.org/draft-07/schema#",
  "$id": "combined_test_case.schema.json",
  "title": "CombinedTestCase",
  "description": "One reviewable semantic experience test case and its pre-authored customer hypothesis.",
  "type": "object",
  "additionalProperties": false,
  "required": [
    "case_id",
    "display_id",
    "schema_version",
    "version",
    "title",
    "brief",
    "group",
    "purpose",
    "what_to_watch",
    "real_world",
    "hypothesis",
    "expectations",
    "persona",
    "journey",
    "algorithm_defaults"
  ],
  "properties": {
    "case_id": { "type": "string", "pattern": "^case-[a-z0-9-]+$" },
    "display_id": { "type": "string", "pattern": "^TC-[A-Z][0-9]{2}$" },
    "schema_version": { "type": "string", "const": "1.0.0" },
    "version": { "type": "string" },
    "title": { "$ref": "#/definitions/bilingual" },
    "brief": {
      "description": "Two sentences: what the case is, and why it is worth running.",
      "$ref": "#/definitions/bilingual"
    },
    "what_to_watch": {
      "description": "Situation/preference dimensions to focus on, rendered as chips.",
      "type": "array", "minItems": 1,
      "items": { "$ref": "#/definitions/bilingual" }
    },
    "group": { "$ref": "#/definitions/case_group" },
    "purpose": { "$ref": "#/definitions/bilingual" },
    "real_world": { "$ref": "#/definitions/real_world" },
    "hypothesis": { "$ref": "#/definitions/hypothesis" },
    "expectations": { "$ref": "#/definitions/expectations" },
    "contrast": { "$ref": "#/definitions/contrast" },
    "persona": {
      "type": "object",
      "additionalProperties": false,
      "required": ["persona_id", "name", "narrative", "profile_ref"],
      "properties": {
        "persona_id": { "type": "string" },
        "name": { "$ref": "#/definitions/bilingual" },
        "narrative": { "$ref": "#/definitions/bilingual" },
        "goals": { "type": "array", "items": { "$ref": "#/definitions/bilingual" } },
        "preferences": { "type": "array", "items": { "$ref": "#/definitions/bilingual" } },
        "constraints": { "type": "array", "items": { "$ref": "#/definitions/bilingual" } },
        "assumptions": {
          "description": "ONLY assumptions relevant to this case. No decorative demographics.",
          "type": "array", "items": { "$ref": "#/definitions/bilingual" }
        },
        "profile_ref": {
          "description": "A committed proposal preset or profile id; its driver_profile is resolved and frozen into the run.",
          "type": "string"
        },
        "profile_ref_version": { "type": "string" }
      }
    },
    "journey": {
      "type": "object",
      "additionalProperties": false,
      "required": ["narrative", "scenario_ref", "route_preset_ref", "seed", "tick_seconds"],
      "properties": {
        "narrative": { "$ref": "#/definitions/bilingual" },
        "scenario_ref": { "type": "string" },
        "route_preset_ref": { "type": "string" },
        "seed": { "type": "integer" },
        "tick_seconds": { "type": "integer", "minimum": 1 },
        "fixed_overrides": {
          "description": "Situation/context this case pins. Live values (drowsiness, fatigue, monotony, traffic, road) still come from the tick engine.",
          "type": "object",
          "additionalProperties": false,
          "properties": {
            "initial_drowsiness": { "type": "number", "minimum": 0, "maximum": 100 },
            "initial_fatigue": { "type": "number", "minimum": 0, "maximum": 100 },
            "is_night": { "type": "boolean" },
            "child_passenger": { "type": "boolean" },
            "route_tags": { "type": "array", "items": { "type": "string" } },
            "destination_tags": { "type": "array", "items": { "type": "string" } },
            "multiple_passengers": { "type": "boolean" },
            "mountain_range_km": { "type": "array", "items": { "type": "number" }, "minItems": 2, "maxItems": 2 },
            "jam_range_km": { "type": "array", "items": { "type": "number" }, "minItems": 2, "maxItems": 2 }
          }
        },
        "automatic_path": {
          "description": "Deterministic choices only — NOT a general walkthrough language. Omitted means the quickview convention: rank 1.",
          "type": "object",
          "additionalProperties": false,
          "properties": {
            "service_choice": { "type": "string", "enum": ["rank_1"] },
            "rest_response": { "type": "string", "enum": ["accept", "decline", "ignore"] },
            "sleep_minutes": { "type": "integer", "minimum": 0 }
          }
        }
      }
    },
    "algorithm_defaults": {
      "description": "Defaults, NOT part of expected behaviour. A candidate version may be substituted while the case stays the same.",
      "type": "object",
      "additionalProperties": false,
      "required": ["trigger", "service", "content"],
      "properties": {
        "trigger": { "type": "string" },
        "service": { "type": "string" },
        "content": { "type": "string" }
      }
    }
  },
  "definitions": {
    "bilingual": {
      "type": "object",
      "additionalProperties": false,
      "required": ["ja", "en"],
      "properties": { "ja": { "type": "string" }, "en": { "type": "string" } }
    },
    "case_group": {
      "type": "string",
      "enum": ["rest", "monotony", "environment", "service", "content", "integrated"]
    },
    "real_world": {
      "type": "object",
      "additionalProperties": false,
      "required": ["before_trip", "trip_reason", "state_at_departure", "journey_evolution"],
      "properties": {
        "before_trip": { "$ref": "#/definitions/bilingual" },
        "trip_reason": { "$ref": "#/definitions/bilingual" },
        "state_at_departure": { "$ref": "#/definitions/bilingual" },
        "journey_evolution": { "$ref": "#/definitions/bilingual" }
      }
    },
    "hypothesis": {
      "type": "object",
      "additionalProperties": false,
      "required": ["rationale"],
      "properties": {
        "rationale": { "$ref": "#/definitions/bilingual" }
      }
    },
    "expectations": {
      "type": "object",
      "additionalProperties": false,
      "required": ["trigger", "service", "content"],
      "properties": {
        "trigger": { "$ref": "#/definitions/trigger_expectation" },
        "service": { "$ref": "#/definitions/service_expectation" },
        "content": { "$ref": "#/definitions/content_expectation" }
      }
    },
    "trigger_expectation": {
      "type": "object",
      "additionalProperties": false,
      "required": ["outcome"],
      "properties": {
        "outcome": {
          "type": "string",
          "enum": ["rest_required", "monotony_prevention", "none"]
        },
        "time_window_min": { "$ref": "#/definitions/nonnegative_range" },
        "max_fire_count": { "type": "integer", "minimum": 0 },
        "required_positive_feature_ids": {
          "type": "array",
          "items": { "type": "string", "minLength": 1 },
          "uniqueItems": true
        }
      }
    },
    "service_expectation": {
      "type": "object",
      "additionalProperties": false,
      "required": [
        "rank_1_acceptable_ids",
        "top_3_required_ids",
        "top_3_prohibited_ids",
        "required_positive_feature_ids"
      ],
      "properties": {
        "rank_1_acceptable_ids": {
          "type": "array",
          "items": { "type": "string", "minLength": 1 },
          "uniqueItems": true
        },
        "top_3_required_ids": {
          "type": "array",
          "items": { "type": "string", "minLength": 1 },
          "uniqueItems": true
        },
        "top_3_prohibited_ids": {
          "type": "array",
          "items": { "type": "string", "minLength": 1 },
          "uniqueItems": true
        },
        "required_positive_feature_ids": {
          "description": "Positive evidence required on the actual rank-1 candidate.",
          "type": "array",
          "items": { "type": "string", "minLength": 1 },
          "uniqueItems": true
        }
      }
    },
    "content_expectation": {
      "type": "object",
      "additionalProperties": false,
      "required": ["expected_stage_outcome", "required_track_ids", "excluded_track_ids"],
      "properties": {
        "expected_stage_outcome": {
          "type": "string",
          "enum": ["complete_plan", "unsupported_service", "not_applicable"]
        },
        "returned_count": { "type": "integer", "minimum": 0 },
        "required_track_ids": {
          "type": "array",
          "items": { "type": "string", "minLength": 1 },
          "uniqueItems": true
        },
        "excluded_track_ids": {
          "type": "array",
          "items": { "type": "string", "minLength": 1 },
          "uniqueItems": true
        },
        "oshi_artist_id": { "type": "string", "minLength": 1 },
        "mean_arousal_range": { "$ref": "#/definitions/unit_range" }
      }
    },
    "contrast": {
      "type": "object",
      "additionalProperties": false,
      "required": ["role", "with_case_id", "kind", "changed_inputs", "expected_delta"],
      "properties": {
        "role": { "type": "string", "enum": ["baseline", "variant"] },
        "with_case_id": { "type": "string", "pattern": "^TC-[A-Z][0-9]{2}$" },
        "kind": {
          "type": "string",
          "enum": ["controlled_one_factor", "semantic_real_world"]
        },
        "changed_inputs": {
          "type": "array",
          "items": { "type": "string", "minLength": 1 },
          "uniqueItems": true
        },
        "expected_delta": { "$ref": "#/definitions/bilingual" }
      }
    },
    "nonnegative_range": {
      "type": "array",
      "items": { "type": "number", "minimum": 0 },
      "minItems": 2,
      "maxItems": 2
    },
    "unit_range": {
      "type": "array",
      "items": { "type": "number", "minimum": 0, "maximum": 1 },
      "minItems": 2,
      "maxItems": 2
    }
  }
}
