{
  "algorithm_defaults": {
    "content": "aica_transparent_content_selector_v1",
    "service": "aica_transparent_service_selector_v1",
    "trigger": "aica_transparent_hybrid_trigger_v1"
  },
  "brief": {
    "en": "A physically rested commuter has already completed the same familiar highway many times and leaves work late. They drive home on the long Tokyo–Osaka route, with congestion forecast across km 90–170. AICA should issue monotony prevention by 80 minutes, before sustained congestion erodes attention further.",
    "ja": "身体的には休養十分な通勤者が、何度も走った慣れた高速道路へ遅い時間に出発する。 90–170kmに渋滞予測がある長距離の東京–大阪ルートで帰宅する。 AICAは持続渋滞で注意がさらに低下する前、80分までに漫然予防を提案する。"
  },
  "case_id": "case-tc-m05",
  "contrast": {
    "changed_inputs": [
      "journey.scenario.jam_range_km",
      "journey.scenario.route_tags",
      "journey.scenario.traffic_events"
    ],
    "expected_delta": {
      "en": "Painted congestion should advance TC-M05's intervention relative to free-flow TC-M06.",
      "ja": "描画渋滞によりTC-M05の介入は自由流のTC-M06より早まる。"
    },
    "kind": "semantic_real_world",
    "role": "baseline",
    "with_case_id": "TC-M06"
  },
  "display_id": "TC-M05",
  "expectations": {
    "content": {
      "excluded_track_ids": [],
      "expected_stage_outcome": "complete_plan",
      "required_track_ids": [],
      "returned_count": 5
    },
    "service": {
      "rank_1_acceptable_ids": [
        "music_playlist",
        "humming_karaoke"
      ],
      "required_positive_feature_ids": [],
      "top_3_prohibited_ids": [
        "stretch_video",
        "full_karaoke",
        "call_response_stopped"
      ],
      "top_3_required_ids": []
    },
    "trigger": {
      "max_fire_count": 1,
      "outcome": "monotony_prevention",
      "required_positive_feature_ids": [
        "monotony_prevention_score"
      ],
      "time_window_min": [
        30,
        80
      ]
    }
  },
  "group": "monotony",
  "hypothesis": {
    "rationale": {
      "en": "A genuine jam_range paints route facts in addition to the authored event, making congestion an executable part of the comparison. Grounded in CDC-SU Slides 10–17 (familiar or monotonous driving and in-car recovery proposals).",
      "ja": "設定イベントに加えて実際のjam_rangeでルート事実を描画し、渋滞を比較の実行可能な一部にする。 CDC-SUスライド10–17（慣れ・単調による漫然予兆と車内回復提案）に基づく。"
    }
  },
  "journey": {
    "automatic_path": {
      "service_choice": "rank_1"
    },
    "fixed_overrides": {
      "child_passenger": false,
      "destination_tags": [
        "home"
      ],
      "initial_drowsiness": 5,
      "initial_fatigue": 5,
      "is_night": true,
      "jam_range_km": [
        90,
        170
      ],
      "multiple_passengers": false,
      "route_tags": [
        "highway",
        "night",
        "familiar",
        "congestion"
      ]
    },
    "narrative": {
      "en": "They drive home on the long Tokyo–Osaka route, with congestion forecast across km 90–170. A 45-minute low-speed congestion period begins after 35 minutes on the already familiar, dark highway.",
      "ja": "90–170kmに渋滞予測がある長距離の東京–大阪ルートで帰宅する。 慣れた暗い高速道路で35分後から45分間の低速渋滞が始まる。"
    },
    "route_preset_ref": "long_tokyo_osaka",
    "scenario_ref": "semantic_tc_m05",
    "seed": 42,
    "tick_seconds": 180
  },
  "persona": {
    "assumptions": [
      {
        "en": "Grounded in CDC-SU Slides 10–17 (familiar or monotonous driving and in-car recovery proposals).",
        "ja": "CDC-SUスライド10–17（慣れ・単調による漫然予兆と車内回復提案）に基づく。"
      },
      {
        "en": "The resolved profile-semantic-neutral history is fixed before the trip and is not changed during replay.",
        "ja": "解決済みのprofile-semantic-neutral履歴は出発前に固定し、リプレイ中は変更しません。"
      }
    ],
    "constraints": [
      {
        "en": "The driver must remain attentive and cannot operate a screen while moving.",
        "ja": "走行中は注意を維持し、画面操作はできない。"
      }
    ],
    "goals": [
      {
        "en": "Complete this necessary journey without compromising driving safety.",
        "ja": "必要な移動を、運転の安全を損なわずに終える。"
      }
    ],
    "name": {
      "en": "Night commuter entering prolonged congestion",
      "ja": "長時間渋滞へ入る夜間通勤者"
    },
    "narrative": {
      "en": "Night commuter entering prolonged congestion. A physically rested commuter has already completed the same familiar highway many times and leaves work late.",
      "ja": "長時間渋滞へ入る夜間通勤者。身体的には休養十分な通勤者が、何度も走った慣れた高速道路へ遅い時間に出発する。"
    },
    "persona_id": "persona-congestion-m05",
    "preferences": [
      {
        "en": "Use simple, driving-capable support when intervention is needed.",
        "ja": "介入が必要なときは、走行中に使える簡潔な支援を利用する。"
      }
    ],
    "profile_ref": "profile-semantic-neutral",
    "profile_ref_version": "1.0.0"
  },
  "purpose": {
    "en": "AICA should issue monotony prevention by 80 minutes, before sustained congestion erodes attention further.",
    "ja": "AICAは持続渋滞で注意がさらに低下する前、80分までに漫然予防を提案する。"
  },
  "real_world": {
    "before_trip": {
      "en": "A physically rested commuter has already completed the same familiar highway many times and leaves work late.",
      "ja": "身体的には休養十分な通勤者が、何度も走った慣れた高速道路へ遅い時間に出発する。"
    },
    "journey_evolution": {
      "en": "A 45-minute low-speed congestion period begins after 35 minutes on the already familiar, dark highway.",
      "ja": "慣れた暗い高速道路で35分後から45分間の低速渋滞が始まる。"
    },
    "state_at_departure": {
      "en": "Drowsiness and fatigue start at 5; no preference history obscures the congestion-versus-free-flow comparison.",
      "ja": "眠気と疲労は5から始まり、嗜好履歴は渋滞対自由流の比較を曖昧にしない。"
    },
    "trip_reason": {
      "en": "They drive home on the long Tokyo–Osaka route, with congestion forecast across km 90–170.",
      "ja": "90–170kmに渋滞予測がある長距離の東京–大阪ルートで帰宅する。"
    }
  },
  "schema_version": "1.0.0",
  "title": {
    "en": "Intervene before attention fades in prolonged late-night congestion",
    "ja": "深夜の長時間渋滞で注意が薄れる前に介入する"
  },
  "version": "1.0.0",
  "what_to_watch": [
    {
      "en": "AICA should issue monotony prevention by 80 minutes, before sustained congestion erodes attention further.",
      "ja": "AICAは持続渋滞で注意がさらに低下する前、80分までに漫然予防を提案する。"
    },
    {
      "en": "Whether the authored state and journey evidence remain visible in the explanation for TC-M05.",
      "ja": "TC-M05の説明に、設定した状態と旅程の根拠が明示されるか。"
    },
    {
      "en": "Whether downstream service and content behavior follows the declared expectation without hidden overrides.",
      "ja": "下流のサービス・コンテンツ挙動が、隠れた上書きなしで宣言済み期待に従うか。"
    }
  ]
}
